招聘主题,用人单位,发布日期,浏览次数
博士后 管培生 数字科技方向 /节能环保方向 /智能制造方向 /现代流通方向 /综合管理方向/市场贸易类 /计算机类/ 环保化工类 /机械电气类 /材料冶金类 /土木工程类 /财务金融审计类 /综合管理类 /法务风控类,杭州钢铁集团有限公司,2021-11-18,0
嵌入式硬件研发工程师/电气研发工程师,保定市冀能电力自动化设备有限公司,2021-11-18,0
Java开发工程师/数据开发工程师/算法开发工程师/前端开发工程师/产品经理/数据分析师,途家网网络技术（北京）有限公司,2021-11-17,0
技术/销售工程师,北京爱万提斯科技有限公司,2021-11-17,0
航天卫星设计,中国科学院微小卫星创新研究院,2021-11-17,0
连锁运营管理方向/线上运营方向/产品运营方向/市场企划方向/产品采购方向/关务方向/品控方向/物流管理方向/销售管理方向/财经管理方向/人力资源管理方向/总裁助理方向/IT方向,鲜丰水果股份有限公司,2021-11-17,0
机器人系统机械设计与控制/机器人电机系统设计与控制 助理研究员/工程师,中国科学院自动化研究所,2021-11-17,0
产品测试岗/架构设计岗/大数据分析岗/程序开发岗,启明信息技术股份有限公司,2021-11-17,0
审计实习岗/税务实习岗/JAVA开发实习岗/前端开发实习岗/软件测试实习岗/人力资源实习岗,中汇会计师事务所（特殊普通合伙）,2021-11-17,0
算法工程师/安全工程师/运维工程师/测试工程师/开发工程师,平安普惠融资担保有限公司,2021-11-17,0
福建省内企事业单位各类岗位,福建省引进人才服务中心（福建省留学回国人员工作站）,2021-11-17,0
卫星导航算法设计师 /机器视觉算法设计师 /自动控制算法设计师/ 嵌入式软件设计师 /嵌入式硬 件设计师/ FPGA逻辑设计师/机械设计师/JAVA设计师 /测试工程师 /销售,无锡卡尔曼导航技术有限公司,2021-11-17,0
销售助理,成都讯为科技有限公司,2021-11-17,0
仪器研发工程师 /试剂研发工程师 /应用开发工程师/ 实验技术员 /工艺工程师 /售后技术经理 /产品经理 /销售经理 /大客户经理 /临床监察员 /商业分析岗,西安天隆科技有限公司,2021-11-17,0
新设机构类/总行部分部门类,云南红塔银行股份有限公司,2021-11-17,0
PLM开发顾问/PLM实施顾问/MOM开发顾问/MOM实施顾问,北京天圣华信息技术有限责任公司,2021-11-17,0
售前助理工程师,成都讯为科技有限公司,2021-11-17,0
电气设计/硬件开发/软件开发 （嵌入式方向）/软件开发/技术支持/产品测试/会计/人力资源管理,珠海许继电气有限公司,2021-11-17,0
养殖生产岗/综合管培生/畜牧工程部/环保大学生/储备兽医师/基地财务大学生/生产实习生/销售实习生/财务实习生/营销管培生/技术管培生/预算大学生/机械自动化大学生/配方师/生产管理储备干部/采购专员/品质管理储备干部/人力资源管培生/财务管理专员/审计专员/法务专员/监察专员/初级开发工程师,江西正邦科技股份有限公司,2021-11-17,0
超潜管培生（证券研究方向）/财务风控岗,锐方（上海）私募基金管理有限公司,2021-11-17,0
公务员,北京市顺义区人才服务中心,2021-11-17,0
文职类/技术类,民航西南地区空管局,2021-11-17,0
安全技术实习人员,成都同德时代安全科技有限公司,2021-11-16,0
专业技术岗,国家石油天然气管网集团有限公司西气东输分公司,2021-11-16,0
航空产品工艺工程师/企业管理,中国航空工业集团公司金城南京机电液压工程研究中心,2021-11-16,0
专项研究员,山西云时代技术有限公司,2021-11-16,0
网络与信息安全技术岗/互联网信息研究岗,国家计算机网络应急技术处理协调中心上海分中心,2021-11-16,0
模拟电路设计工程师（电源方向）/ 模拟电路设计工程师（信号链） /数字电路设计工程师/ 测试研发工程师 /测试工程师 /应用工程师（信号链方向）/ 应用工程师（电源方向）/ 现场应用工程师 /版图工程师/版图工程师助理 /设计支持工程师 /项目管理工程师 /IT运维工程师 /射频IC设计工程师 /模拟电路设计工程师（射频方向） /RF MEMS设计工程师 现场应用工程师-射频方向 /测试工程师-射频方向,圣邦微电子（北京）股份有限公司,2021-11-16,0
研发类 /技术类 /综合职能类,苏州晶方半导体科技股份有限公司,2021-11-16,0
专利代理师（软件通讯、机械、光电、电子电路、生物医药、化学材料领域）,深圳紫藤知识产权代理有限公司成都分公司,2021-11-16,0
网络与信息安全技术岗,国家计算机网络应急技术处理协调中心广西分中心,2021-11-16,0
电学专利工程师/机械专利工程师/生化专利工程师/涉外专利工程师,广州三环专利商标代理有限公司,2021-11-16,0
研发设计类/研发试验类/试验测试类/控制类/电气类/软件类/管理类/技能类/其他类,中国航发湖南动力机械研究所,2021-11-16,0
新能源学院教师,南京理工大学,2021-11-16,0
行业研究岗,中粮集团有限公司,2021-11-16,0
弹道设计工程师/姿控设计工程师/气动设计工程师/导航设计工程师/仿真设计工程师/结构设计工程师/机电设计工程师/强度分析工程师/web前端工程师/JAVA开发工程师/应用软件开发工程师/FPGA工程师/嵌入式软件开发工程师/硬件设计工程师/射频、天线工程师/电气系统工程师/惯性导航工程师/固体火箭发动机设计工程师/固体火箭发动机工艺工程师/质量专员/产品保障专员/市场专员/新媒体运营专员/人事行政专员/法务专员/财务专员等,北京零壹空间科技有限公司,2021-11-16,0
辅导员,郑州大学,2021-11-15,0
学校教学类/医疗卫生类,中共盐城市委组织部,2021-11-15,0
外延工程师/芯片工程师,材料科学姑苏实验室,2021-11-15,0
研发工程师,中车株洲电力机车研究所有限公司,2021-11-15,0
大学生和技能人才,南昌市10万人才来昌留昌创业就业“百场校招活动”网络招聘会,2021-11-15,0
机械/算法/软件/嵌入/电气/测控/软件测试/光学/硬件/运动控制/固件/产品经理,苏州天准科技股份有限公司,2021-11-15,0
风险管理（上海+郑州）/市场营销（上海）/数据分析（上海）/软件研发（郑州）/信息安全（郑州）/UI（上海+郑州）,河南中原消费金融股份有限公司,2021-11-15,0
编辑记者/营销发行/业务管理/计算机,南方出版传媒股份有限公司,2021-11-15,0
激光工艺工程师/销售工程师/采购工程师/软件工程师/技术支持工程师/设备装配调试工程师/七、控制工程师,浙江中科镭特电子有限公司,2021-11-15,0
江苏省阜宁县2022年面向全国部分高校 和境外世界名校引进优秀毕业生工作公告,中国共产党阜宁县委员会组织部,2021-11-15,0
人力资源岗/党务干事/行政综合岗/投资管理岗/企业管理岗/财务会计/工程管理岗/技术管理岗/安全管理岗/充电桩业务,广州发展新能源股份有限公司,2021-11-15,0
研发序列/营销序列/技术序列,烟台东方威思顿电气有限公司,2021-11-15,0
郑州太古可口可乐管理培训生,郑州太古可口可乐饮料有限公司,2021-11-14,0
教育系统,成都高新技术产业开发区教育文化和卫生健康局,2021-11-12,0
研发工程师/高级研发工程师/电气自动化/机械工程,宁波东旭成新材料科技有限公司,2021-11-12,0
IC测试开发工程师（无锡、南京）/ IC应用验证工程师（无锡）/ 硬件开发工程师（无锡）/ 检验工程师（无锡）/ 试验工程师（无锡）/产品工程师（无锡、南京）/ 设备维护工程师（无锡）/市场业务员（成都、西安、无锡）,无锡中微腾芯电子有限公司,2021-11-12,0
IT研发方向,大家人寿保险股份有限公司四川分公司,2021-11-12,0
JAVA开发工程师/C++开发工程师/前端开发工程师/测试工程师/技术支持工程师/产品经理,北京掌上先机网络科技有限公司,2021-11-12,0
电气设计工程师,安徽巨一科技股份有限公司,2021-11-12,0
弹道设计工程师/姿控设计工程师/气动设计工程师/导航设计工程师/仿真设计工程师/结构设计工程师/机电设计工程师/强度分析工程师/web前端工程师/JAVA开发工程师/应用软件开发工程师/FPGA工程师/嵌入式软件开发工程师/硬件设计工程师/射频、天线工程师/电气系统工程师/惯性导航工程师/固体火箭发动机设计工程师/固体火箭发动机工艺工程师/质量专员/产品保障专员/市场专员/新媒体运营专员/人事行政专员/法务专员/财务专员等,北京零壹空间科技有限公司,2021-11-12,0
技术开发工程师,中国共产党成都市金牛区委员会组织部,2021-11-12,0
党务管理员/纪检监察员/消防管理员/直播营销策划员/直播营销主播/产品研发员/香精香料研究员/人工智能研发员/互联网及新媒体研究员/烟叶生产技术员/信息数据管理员/物流管理员1/物流管理员2/ 烟叶养护员/技术员1/技术员2/技术员3/操作员/技术员1/技术员2/技术员3/技术员4/综合管理员/操作员,广西中烟工业有限责任公司,2021-11-12,0
日语运营,成都熊猫说科技有限公司,2021-11-12,0
机械类/电气类/计算机类/电子信息类/管理类,一汽解放青岛汽车有限公司,2021-11-12,0
专利工程师,广州三环专利代理有限公司,2021-11-12,0
测试助理工程师/电子助理工程师/照明设计/机械助理工程师/工业设计/国内销售/海外销售,赛尔富电子有限公司,2021-11-12,0
技术研发类/工程服务类/市场营销类/生产制造类/管理培训生/职能类,浙江中控技术股份有限公司,2021-11-12,0
网络空间安全学院教师,南京理工大学,2021-11-12,0
中物院高性能数值模拟软件中心研发岗,北京应用物理与计算数学研究所,2021-11-12,0
JAVA开发工程师/C++开发工程师/web前端工程师/测试工程师/技术支持工程师/产品经理,北京掌上先机网络科技有限公司,2021-11-12,0
初中数学教师,四川天府新区十一学校,2021-11-12,0
产品/工艺/材料工程 /机械设计/ 等离子体/射频工程等,中微半导体设备（上海）股份有限公司,2021-11-12,0
模拟电子工程师/电力电子工程师/数字电子工程师/软件开发工程师/嵌入式软件工程师/自动控制工程师/电磁兼容工程师/安规认证工程师,先进科技（中国）有限公司,2021-11-11,0
深圳市建筑科学研究院股份有限公司2022年校招公信检测员/助理结构工程师/助理建筑师,深圳市建筑科学研究院股份有限公司,2021-11-11,0
连锁运营管理方向/线上运营方向/产品运营方向/市场企划方向/产品采购方向/关务方向/品控方向/物流管理方向/销售管理方向/财经管理方向/人力资源管理方向/总裁助理方向/IT方向/,鲜丰水果股份有限公司,2021-11-11,0
现场应用工程师/电源应用工程师/模拟/混合集成电路设计/验证工程师/IC验证工程师,北京升宇科技有限公司,2021-11-11,0
java开发/web前端开发,浩鲸云计算科技股份有限公司,2021-11-11,0
市场营销类/销售运营类/技术研发类/人力行政管理类/财务管理类,成都新潮传媒集团有限公司,2021-11-11,0
研发类/工艺/调试/其他类,成都中电锦江信息产业有限公司,2021-11-11,0
Python开发工程师/量子器件工程师/微波工程师/FPGA开发工程师/量子测控科学家/硬件工程师/C++软件开发工程师/IDE开发工程师/机器学习工程师/算法工程师（量子程序编译方向）等,合肥本源量子计算科技有限责任公司,2021-11-11,0
研发类/销售类/职能类,深圳市思达仪表有限公司,2021-11-11,0
图像算法/视觉算法工程师/机器人控制算法工程师/机械设计工程师/图像处理算法工程师/机器人视觉应用工程师/电气设计工程师/助理电气工程师,普达迪泰（成都）智造研究院有限公司,2021-11-11,0
机械工程师,烟台杰瑞石油服务集团股份有限公司,2021-11-11,0
保险精算 /财会投资 /内控稽核 /信息技术 /通用前台 /通用中台 /通用后台,小康人寿保险有限责任公司,2021-11-11,0
机械工程师/电气工程师/工艺工程师,中天科技集团有限公司,2021-11-11,0
理财顾问/ 项目经理/投顾助理/储备管理,第一创业证券股份有限公司四川分公司,2021-11-10,0
后端开发工程师/前端开发工程师/算法工程师/机器学习/数据挖掘/自然语言处理工程师/大数据研发工程师/分布式数据平台开发工程师,杭州硕磐智能科技有限公司,2021-11-10,0
技术研发岗,河南四方达超硬材料股份有限公司,2021-11-10,0
c++/Java/,成都未尔科技有限公司,2021-11-10,0
销售类/技术服务类/售后服务类/教育培训类/智能智造自动化方向/智能智造软件开发方向,北京发那科机电有限公司,2021-11-10,0
C++开发工程师/服务端开发工程师/前端开发工程师/算法工程师/软件测试工程师,武汉金山办公软件有限公司,2021-11-10,0
嵌入式工程师/硬件设计工程师（助理）/售后FAE/应用软件开发/商显售前工程师/外观、ID设计/PCB layout设计师/软件测试工程师/结构设计师/项目助理工程师,保华微电子有限公司,2021-11-10,0
软件工程师/硬件工程师/结构工程师/测试工程师,上海派能能源科技股份有限公司,2021-11-10,0
管培生,大悦城控股集团（浙江）有限公司,2021-11-10,0
汽车研发（北京/上海) /自动驾驶（北京/上海）/智能与信息技术（北京/上海）/生产制造（北京/江苏常州）/供应链（北京/上海/江苏常州/四川绵阳） /综合管理（北京/上海/常州）/ 职能（北京/上海/常州,北京理想汽车有限公司,2021-11-10,0
Trainee-自动化方向,天津雀巢有限公司,2021-11-10,0
基站物理层开发工程师/DSP程序开发工程师/物理层算法岗,易科奇通信技术（深圳）有限公司,2021-11-10,0
科研人员,贵州航天计量测试技术研究所,2021-11-10,0
量化策略研究员（实习留用）,上海念空数据科技中心（有限合伙）,2021-11-10,0
四川省2022届急需紧缺专业选调生\市属事业单位以及各县（区）引进人才\市属国有或国有控股企业引进人才,中共宜宾市委人才工作局,2021-11-10,0
工程师,戴姆勒大中华区投资有限公司,2021-11-10,0
嵌入式系统开发工程师/产品工程师/结构设计工程师/技术支持工程师,桂林星空建腾电子科技有限公司,2021-11-10,0
技术销售工程师/大客户经理/软件工程师/硬件工程师/网络安全工程师/通信工程师/射频微波（5G）测试工程师/中央监测系统工程师/操作系统工程师/汽车电子技术工程师/汽车诊断应用工程师/NVH工程师/自动化技术工程师/QT开发工程师/嵌入式工程师/产品拓展专员/大客户专员/网站开发工程师/网站内容/市场专员/储备财务经理/招聘专员,广州虹科电子科技有限公司,2021-11-10,0
人力行政管培生/公共关系管培生等,浙江钱江摩托股份有限公司,2021-11-10,0
产品管培生/市场管培生/职能管培生/运营管培生,伙伴智慧（北京）信息技术有限公司,2021-11-10,0
化工类等,金能化学（青岛）有限公司,2021-11-10,0
投融资项目经理/法务经理/行政经理,深圳市中小微企业投资管理有限公司,2021-11-10,0
储备人才类/机务类/航务类/地面服务类/运行管理类/工程管理类/医学类/规划投资类/市场营销类/法律类/财务审计类/行政管理类/采购管理类/研发培训类/科研类/党宣工团纪类等,中国东方航空股份有限公司,2021-11-10,0
财务管理/会计管理/信贷管理/风险管理,宁夏银行股份有限公司,2021-11-10,0
管理培训生/金融科技人才/市县分支机构营销人员/营运人员,海南银行股份有限公司,2021-11-09,0
学科教师/行政管理/文案策划/机器人编程教师（少儿编程、创客老师、乐高编程、少儿机器人）,望子成龙教育科技有限公司,2021-11-09,0
机电研发岗,潮州三环（集团）股份有限公司,2021-11-09,0
专业人才/管培生/分支行储备生/子公司及驻行纪检监察组等,重庆农村商业银行股份有限公司,2021-11-09,0
嵌入式软件工程师/数字电路设计工程师/数字电路验证工程师/硬件工程师/自动化测试工程师,恒玄科技（上海）股份有限公司,2021-11-09,0
边缘计算应用开发实习（研发、产品）,西门子工业自动化产品（成都）有限公司,2021-11-09,0
嵌入式软件开发工程师,成都子辰时频科技有限公司,2021-11-09,0
事业编制,深圳市盐田区,2021-11-09,0
c++/Java/,北京未尔锐创科技有限公司,2021-11-09,0
SMT工程师,仁宝信息技术（昆山）有限公司,2021-11-09,0
机器学习负责人/软件负责人/嵌入式系统负责人/电路负责人/硬件原型开发负责人/显示算法负责人/VR 3D引擎科学家/图形图像算法科学家/安卓高级软件负责人/ISP 图像算法负责人/人体感知与视觉科学家/显示、光学测试负责人/先进显示技术研发负责人/显示驱动面板设计负责人/显示背板制程器件工程负责人/显示驱动IC设计负责人/IT 工程师 （服务器）/实验室管理员,甬江实验室,2021-11-09,0
CAD三维设计师,四川博纳致达信息科技有限公司,2021-11-09,0
董事会秘书,四川现代教育集团,2021-11-09,0
采购员/制程工程师/规划师/人力资源/测试工程师/机构设计工程师/PLC开发工程师/EHS工程师/项目助理/数据分析师/成本分析师/精益管理师/自动化工程师/经营分析师,捷普科技成都有限公司,2021-11-09,0
总行管培生/分支机构管培生/营业网点业务岗/定向营业网点业务岗,潍坊银行股份有限公司,2021-11-09,0
技术研发/封装技术开发/新产品开发/制程工程师/设备工程师/管理类/软件开发/动力工程技术,通富微电子股份有限公司,2021-11-09,0
博士后/产品设计/工艺技术/机械技术/电气技术/模具技术/生产管理/改善管理/质量管理/市场营销,四川宏发电声有限公司,2021-11-09,0
游戏开发工程师,上海域起网络科技有限公司,2021-11-08,0
材料开发类\OLED材料开发\光学设计类\显示技术研究类\仿真设计类\电磁仿真\面板设计类\器件开发类\OLED工艺器件开发\战略与企管类\电子设计类,深圳市华星光电技术有限公司,2021-11-08,0
管培生,北京中公教育科技股份有限公司四川分公司,2021-11-08,0
软件开发岗/证件芯片安全研究岗/数据算法研发岗/仿真系统研发岗 /数据分析岗,国家移民管理局出入境管理信息技术研究所,2021-11-08,0
技术研发及项目工程师/业务专员,金川集团股份有限公司,2021-11-08,0
软件研发类/硬件研发类/供应链/产品类,小米科技有限责任公司,2021-11-08,0
嵌入式软件工程师/Android开发工程师/硬件开发工程师/Web后端开发工程师/Web前端开发工程师/质量工程师,深圳市艾迪思特信息技术有限公司,2021-11-08,0
初级游戏软件开发工程师,北京光宇在线科技有限责任公司成都分公司,2021-11-08,0
项目管理岗/IT信息岗/证照事务岗/销控岗/价格管理岗/客户关系岗/财务管理岗,广州市敏捷投资有限公司,2021-11-08,0
嵌入式软件工程师/ 嵌入式软件工程师（SOC）/ 嵌入式软件工程师（ARM）/ 嵌入式软件工程师（信号处理）/ C、C++软件工程师 上位机软件工程师 /电路设计工程师 /研发测试工程师/产品经理 /研发助理 /FPGA开发工程师 /芯片设计工程师/ IC验证工程师/ 视觉SLAM算法工程师/ 卫星基带算法工程师 /卫星导航算法、RTK算法工程师/ 惯性、组合导航算法工程师,湖南北云科技有限公司,2021-11-08,0
Java研发工程师/前端研发工程师,贝壳找房（北京）科技有限公司,2021-11-08,0
工程技术岗,中国建筑第七工程局有限公司西南分公司,2021-11-08,0
弹道设计工程师/姿控设计工程师/气动设计工程师/导航设计工程师/仿真设计工程师/结构设计工程师/机电设计工程师/强度分析工程师/web前端工程师/JAVA开发工程师/应用软件开发工程师/FPGA工程师/嵌入式软件开发工程师/硬件设计工程师/射频、天线工程师/电气系统工程师/惯性导航工程师/固体火箭发动机设计工程师/固体火箭发动机工艺工程师/质量专员/产品保障专员/市场专员/新媒体运营专员/人事行政专员/法务专员/财务专员等,北京零壹空间科技有限公司,2021-11-08,0
专业化人才\管理培训生\营销型人才,四川天府银行股份有限公司,2021-11-08,0
产品研发/技术岗/管理岗,陕西凌云电器集团有限公司,2021-11-08,0
财务审计（2022校招）/财务审计实习生（非校招）/资产评估（2022校招）/管理咨询（2022校招）,天健会计师事务所（特殊普通合伙）四川分所,2021-11-08,0
大学教师,重庆移通学院,2021-11-08,0
研发序列/营销序列/技术序列,烟台东方威思顿电气有限公司,2021-11-08,0
安卓应用/多媒体开发/驱动/无线通信协议/信息安全/Devops/算法/射频工程师,OPPO广东移动通信有限公司,2021-11-08,0
科研创新岗/开发管理岗/综合管理岗/产业管理岗/设计管理岗/投资财会岗/合规管理岗,中铁文化旅游投资集团有限公司,2021-11-08,0
生产技术类储干/品质管理类储干/研发技术类储干/设备维护类储干/安全、消防、环保类储干/供应链类储干/项目管理类储干,蓝思科技股份有限公司,2021-11-08,0
版图工程师/芯片设计工程师/软件测试/软件开发/web前端/半导体应用咨询工程师,杭州广立微电子股份有限公司,2021-11-08,0
芯片设计/SIP封装设计/微波设计/天线设计/FPGA设计/总体设计/算法设计/C++软件设计/C#软件设计/电路设计/结构设计/电气工程设计/DSP设计,成都锐芯盛通电子科技有限公司,2021-11-07,0
达州英才计划,达州市,2021-11-06,0
市场BD专业,成都盛誉达电子产品有限公司,2021-11-06,0
机械设计工程师/电气设计工程师,四川科立达智能系统有限公司,2021-11-05,0
规划建设类/信息电子类,江门市人才工作局,2021-11-05,0
工程师-车载网联及智能驾驶/电驱动及电气化/整车工程及开发/柴油发动机整车基础和驾驶性标定-汽油发动机/,河北艾福亿维新能源科技有限公司,2021-11-05,0
财务管理/项目管理储备干部,河南省通信建设管理咨询有限公司,2021-11-05,0
数字IC工程师,富瀚微电子（成都）有限公司,2021-11-05,0
储备干部/技术工程师,江苏希西维轴承有限公司,2021-11-05,0
质量工程师/相分析工程师/工艺工程师/模具工程师/材料研发工程师/模具设计工程师/热处理工程师等等,爱柯迪股份有限公司,2021-11-05,0
专利代理师（通信、电学、机械、自动化等领域）,北京龙双利达知识产权代理有限公司,2021-11-05,0
IT及新技术类/网络类/业务及运营类/市场类/职能支撑,中国联合网络通信有限公司四川省分公司,2021-11-05,0
置业顾问/策划专员/储备销售主管,四川诺嘉信商业管理有限公司,2021-11-05,0
总裁办管培生/业务管培生/Java开发工程师/B端产品经理/专员,同道精英（天津）信息技术有限公司,2021-11-05,0
太仓市2021年度专业化青年人才定岗特选,太仓市人力资源管理服务中心（太仓市创新创业指导中心）,2021-11-05,0
探测器研发工程师/助理工程师、工艺助理（应届）/光刻助理工程师（应届）/品质工程师（应届）/研发助理、研发工程师（应届）,武汉云岭光电有限公司,2021-11-05,0
教师/党政类/医疗类/技术类等,漳州引才招聘,2021-11-05,0
嵌入式软件工程师/硬件工程师/网络测试工程师,广州芯德通信科技股份有限公司,2021-11-04,0
JAVA开发工程师/C++开发工程师/前端开发工程师/测试工程师/技术支持工程师/产品经理,北京掌上先机网络科技有限公司,2021-11-04,0
业务研究岗/品种研发岗,大连商品交易所,2021-11-04,0
管理类/市场营销与策划类/运营管理类/财务管理类/建筑工程类/建筑设计类/酒店管理类/会展类/工程造价类/粮油类,青岛国信发展（集团）有限责任公司,2021-11-04,0
软件技术/硬件技术/职能/销售,拓维信息系统股份有限公司,2021-11-04,0
科技规划管理岗/应用系统开发岗/系统及网络管理岗/技术运行操作岗/登记结算业务岗（法律类/会计类/统计类/财经类)/综合管理岗（法律类/会计审计类/新闻类）/数据中心管理岗等,中国证券登记结算有限责任公司,2021-11-04,0
智慧金融岗/研发维护岗/人力资源岗/金融市场交易岗/宣传岗,遂宁银行股份有限公司,2021-11-04,0
电子工程师/电气工程师/算法工程师/应用工程师,北京未磁科技有限公司,2021-11-04,0
项目开发经理/项目营销经理,特变电工新疆新能源股份有限公司,2021-11-04,0
算法工程师/FPGA工程师,成都九华圆通科技发展有限公司,2021-11-04,0
