招聘主题,用人单位,发布日期,浏览次数
Marketing 品牌管理培训生/Sales 营销管理培训生,深圳市韶音科技有限公司,2021-11-04,0
导航规划算法工程师/电机控制算法工程师/机器人算法工程师/机械臂规划工程师/图像算法工程师/运动控制算法工程师/AI算法工程师/Slam算法工程师/人机交互（HRI）系统设计师/音频算法工程师/语音信号处理/语音识别算法工程师/系统工程师/硬件工程师/电机控制工程师/AIot工程师/FPGA工程师/上位机硬件工程师/下位机硬件工程师/机械工程师/结构工程师/项目经理/产品经理/解决方案工程师/Web/Golang/Andriod/C++开发工程师/机器人软件开发工程师/仿真开发工程师/软件测试工程师/硬件测试工程师/自动化测试工程师/运营策略/运营支持/产品应用工程师/产品质量工程师/PMC工程师/采购工程师/国际物流管理/仓储管理/招聘管理/培训管理/企业文化/公共事务/财务/海外销售（英/日/俄/韩/法/西/德/意/葡/阿/荷兰语） /海外技术运营（英/日/俄/韩/法/西/德/意/葡/阿/荷兰语）,深圳市普渡科技有限公司,2021-11-03,0
研发类/技术支持类/生产制造类/销售市场类等,恩智浦（中国）管理有限公司,2021-11-03,0
大宗商品业务员/研究员（行业）/财务核算/物流管理/法务内控/Java开发,浙江物产国际贸易有限公司,2021-11-03,0
综合管理岗/博士后研究人员/信息安全岗/系统研发岗/党群工作部（人力资源部）-人力资源岗等,山东省鲁信投资控股集团有限公司,2021-11-03,0
嵌入式软件工程师/ 嵌入式软件工程师（SOC）/ 嵌入式软件工程师（ARM）/ 嵌入式软件工程师（信号处理）/ C、C++软件工程师 上位机软件工程师 /电路设计工程师 /研发测试工程师/产品经理 /研发助理 /FPGA开发工程师 /芯片设计工程师/ IC验证工程师/ 视觉SLAM算法工程师/ 卫星基带算法工程师 /卫星导航算法、RTK算法工程师/ 惯性、组合导航算法工程师,湖南北云科技有限公司,2021-11-03,0
民航类/计算机类/电气/自动化类/土建类/安全类/能源动力类/经营/管理类/行政/文秘类/财务类/电子/通信类/法律类/医学类/生物学类/设计学类,西部机场集团有限公司,2021-11-03,0
建筑工程师/工程造价师/人力资源管理,中国建筑股份有限公司国际工程分公司,2021-11-03,0
雷达电子战仿真工程师/通信仿真工程师/光电和红外仿真工程师/C++研发工程师/CAE仿真工程师/飞行仿真建模工程师/技术支持工程师（电磁方向、通信和网络方向）/销售工程师,成都未尔科技有限公司,2021-11-03,0
算法工程师/软件开发工程师,金航数码科技有限责任公司,2021-11-03,0
C ++开发工程师/数据分析工程师/FPGA,上海广策信息科技有限公司,2021-11-03,0
软件工程师/上位机软件工程师/硬件工程师/结构工程师/产品工程师,八方电气（苏州）股份有限公司,2021-11-03,0
总行管培生/西安城区柜员/西安郊县柜员/地市城区柜员/地市县域柜员,长安银行股份有限公司,2021-11-03,0
研发/市场/职能类岗位,北京数码视讯科技股份有限公司,2021-11-03,0
后端/前端/测试/数据/开发工程师,中国电子系统技术有限公司,2021-11-02,0
FPGA工程师/硬件工程师/嵌入式软件工程师/DSP工程师/算法工程师/雷达信号处理工程师,西安艾索信息技术有限公司,2021-11-02,0
c++开发/Java开发,北京未尔锐创科技有限公司,2021-11-02,0
智能驾驶系统工程师/VCU软件工程师/整车研发工程师/发动机研发工程师/功能安全工程师/见习业务经理/工艺工程师/人力资源专员,浙江春风动力股份有限公司,2021-11-02,0
教师,南京理工大学,2021-11-02,0
软件开发工程师＼硬件开发工程师＼嵌入式软件工程师＼算法工程师,四川湖山电器股份有限公司,2021-11-02,0
2022年江苏省启东市公开选调优秀青年人才(事业编),中共启东市委组织部,2021-11-02,0
后备人才岗,嘉兴市小微企业信保基金融资担保有限公司,2021-11-02,0
综合管理/投资管理/委托贷款/风险管理/税务/法律/运营管理/内部审计/信息技术/人力资源管理等,国家外汇管理局中央外汇业务中心,2021-11-02,0
软件开发工程师/测试工程师,驰骋控股集团股份有限公司,2021-11-02,0
电源工程师/滤波器工程师/测试工程师/质检员/销售,成都讯领科技有限公司,2021-11-02,0
电气工程师/自动化工程师/机械工程师/工艺工程师/工程管理,国家管网集团西部管道有限责任公司,2021-11-02,0
研发助理工程师/测试助理工程师/质检员/销售,成都讯领科技有限公司,2021-11-02,0
弹道设计工程师/姿控设计工程师/气动设计工程师/导航设计工程师/仿真设计工程师/结构设计工程师/机电设计工程师/强度分析工程师/web前端工程师/JAVA开发工程师/应用软件开发工程师/FPGA工程师/嵌入式软件开发工程师/硬件设计工程师/射频、天线工程师/电气系统工程师/惯性导航工程师/固体火箭发动机设计工程师/固体火箭发动机工艺工程师/质量专员/产品保障专员/市场专员/新媒体运营专员/人事行政专员/法务专员/财务专员等,北京零壹空间科技有限公司,2021-11-02,0
国网全球能源互联网研究院直流输电技术研究所2022年度校园招聘,全球能源互联网研究院有限公司,2021-11-02,0
总公司/分公司管理培训生,长城人寿保险股份有限公司,2021-11-02,0
器件设计工程师/DRAM Designer/模拟电路 IC 设计工程师,芯盟科技有限公司,2021-11-02,0
管理培训生/非管理培训生,凯德（中国）企业管理有限公司,2021-11-02,0
研发工程师,交银施罗德基金管理有限公司,2021-11-02,0
机械设计工程师 /产品可靠性工程师 /产品测试工程师 /电气工程师,索恩格汽车部件（中国）有限公司,2021-11-02,0
普通员工\计算机专业员工,安徽省农村信用社联合社,2021-11-02,0
教授/研究员/博士后等,上海交通大学,2021-11-02,0
未来总裁岗 /研发岗/ 信息技术岗 /市场岗 /电商运营岗 /营销管理岗 /市场岗 /人力资源岗 /财务岗 /生产制造岗 /品质管理岗 / 电商运营岗 /营销管理岗 /生产制造岗 /品质管理岗,白象食品股份有限公司,2021-11-02,0
中国科学院空天信息创新研究院教育处,中国科学院空天信息创新研究院,2021-11-01,0
算法工程师/电子研发工程师/机器视觉应用工程师/C++开发工程师/系统集成技术工程师,武汉光谷卓越科技股份有限公司,2021-11-01,0
研发类/技术类,北京晨晶电子有限公司,2021-11-01,0
电气工程师/研发工程师/工艺工程师,北京智束科技有限公司,2021-11-01,0
模拟芯片设计工程师/数字电路验证工程师/版图设计工程师/器件工程师,上海联影微电子科技有限公司,2021-11-01,0
研发管培生/职能管培生/业务管培生,汇通达网络股份有限公司,2021-11-01,0
零售管培生,成都极米科技股份有限公司,2021-11-01,0
Java 开发工程师/前端开发工程师/测试工程师,上海铂略金融信息服务有限公司,2021-11-01,0
助理软件工程师 /助理电机工程师/ 生产储备干部/ PIE助理工程师 /ME助理工程师等,苏州欧圣电气股份有限公司,2021-11-01,0
软件平台及解决方案/电子系统方向/数字化体验平台方向/数据工场与网络安全方向/人力资源管理培训生,上海汽车集团股份有限公司零束软件分公司,2021-11-01,0
通信设计师/建筑设计师/暖通设计师/结构设计师/建筑电气设计师/建筑工程咨询师/软件工程师/大数据分析师/信息安全工程师/信息化咨询师/智能化设计师/培训专员/招标代理工程师/管理培训生,中通服咨询设计研究院有限公司,2021-11-01,0
产品设计工程师/电机设计工程师/电机工艺工程师/电机测试工程师/仿真测试工程师/仿真切割工程师/软件设计工程师/硬件加工工程师/机加工艺工程师/装配工艺工程师/研发质量工程师/市场质量工程师/质量工程师（IPQC）/计量工程师/理化工程师/采购工程师/计划师/物控员/制造储备干部/装配储备干部/工务储备干部/软件开发工程师（C+ +方向）,广州市昊志机电股份有限公司,2021-11-01,0
专业人才/管培生/分支行储备生/子公司及驻行纪检监察组等,重庆农村商业银行股份有限公司,2021-11-01,0
农资营销（技术）岗/财务会计岗/人力资源 管理岗,浙农集团股份有限公司,2021-11-01,0
财务审计类/人事行政类/投资分析类/营销业务类/工程管理类,浙农控股集团有限公司,2021-11-01,0
C++/QT开发工程师,成都睿芯行科技有限公司,2021-11-01,0
人工智能领域开发工程师,北京（海淀）大数据先进技术研究院（北京大数据先进技术研究院）,2021-11-01,0
JAVA开发工程师,佰墨思（成都）数字技术有限公司,2021-11-01,0
网点柜员,中国邮政集团有限公司湖南省分公司,2021-11-01,0
技术类/营销类/运营类,北京必创科技股份有限公司,2021-11-01,0
版图工程师 /氮化镓器件工程师 /碳化硅器件工程师 /工艺工程师 /设备工程师/ IE工程师 /供应商管理 /品质制程工程师 /CS工程师 /失效分析工程师 /安全工程师 /水处理系统工程师 /气化系统工程师 /水处理系统工程师 /商务专员 /采购专员,深圳方正微电子有限公司,2021-11-01,0
管培生,上海微创医疗机器人（集团）股份有限公司,2021-11-01,0
技术类/支持类/市销类,上海微创电生理医疗科技股份有限公司,2021-11-01,0
毒理专题负责人/病理专题负责人/药理专题负责人/分析专题负责人/分析方法开发专题负责人,北京昭衍新药研究中心股份有限公司,2021-11-01,0
科研人员,杭州仰仪科技有限公司,2021-11-01,0
研发序列/营销序列/技术序列,烟台东方威思顿电气有限公司,2021-11-01,0
模拟IC设计工程师/射频电路设计工程师/RFIC设计工程师,北京博瑞微电子科技有限公司,2021-11-01,0
党群干事/技术工程师/工程类工程师/人力行政专员/机加工艺工程师/客户经理/客户销售等,四川波鸿实业有限公司,2021-11-01,0
助理信息技术工程师/助理互联网金融开发工程师/助理互联网金融开发工程师,汇添富基金管理股份有限公司,2021-11-01,0
研发/产品/运营/市场/设计,北京闪送科技有限公司,2021-11-01,0
产品经理/商务经理/大客户经理,北京必创科技股份有限公司,2021-11-01,0
【空中双选】 电子科技大学2021年暖冬专场空中双选会学生邀请函,电子科技大学学生就业指导中心,2021-11-01,0
海外市场营销管培生,四川卓尔天讯电子有限公司,2021-11-01,0
科曼医疗22届营销精英,深圳市科曼医疗设备有限公司,2021-10-31,0
硬件测试工程师/微波工程师/射频工程师/软件开发工程师/认证工程师/嵌入式软件工程师/结构测试工程师/工艺设计工程师/单板开发工程师/夹具设计工程师/器件设计工程师/版图设计工程师/中道工艺工程师/压铸工程师/模具设计工程师/结构件工艺工程师/机械技术工程师/电镀工艺工程师,武汉凡谷电子技术股份有限公司,2021-10-31,0
运维专工/工程造价,华电西藏能源有限公司,2021-10-31,0
海豚生—管培生,上海德邦物流有限公司,2021-10-30,0
投行业务岗/研究员/销售经理/储备干部/交易员,川财证券有限责任公司,2021-10-30,0
战略管理类,大家保险集团有限责任公司,2021-10-29,0
营销管理类/研发技术类/职能管理类/智能制造类,杭州老板电器股份有限公司,2021-10-29,0
研发工程师,贵州梅岭电源有限公司,2021-10-29,0
JAVA开发工程师/C++开发工程师/前端开发工程师/测试工程师/技术支持工程师/产品经理/人力专员/财务专员,北京掌上先机网络科技有限公司,2021-10-29,0
省联社本部人才/信息科技中心人才,四川省农村信用社联合社,2021-10-29,0
人力资源/专利工程师/外贸销售 /国内销售/ 跨境电商运营/ 软件工程师/ 硬件工程师等,深圳市华思旭科技有限公司,2021-10-29,0
软件开发类 /硬件开发类 /网络安全技术研究类/密码研究类/产品测试类/人力资源/财务管理/成本管理/物资采购类,西南通信研究所（中国电子科技集团公司第三十研究所）,2021-10-29,0
分行营销精英培训生/金融科技类,广发银行股份有限公司长沙分行,2021-10-29,0
人工智能/计算机类/车辆工程/ 机械/ 电机与电器/ 电力系统/电子/ 自动化/热能与动力工程/供应链/统计学/密码学/营销/管理/语言,北京汽车集团有限公司,2021-10-29,0
硬件设计工程师/软件工程师（上位机方向）/FPGA开发方向/深度学习工程师/机械设计工程师,合肥安晶龙电子股份有限公司,2021-10-29,0
研发工程师/运营及销售类管培生/财务类管培生/人事行政及后台管理类管培生/技术支持工程师,深圳市神舟电脑股份有限公司,2021-10-29,0
游戏策划管培生,广州四三九九信息科技有限公司,2021-10-29,0
研发工程师 /质量工程师 /工艺工程师 /采购工程师 /电镀工艺工程师,上海雷迪埃电子有限公司,2021-10-29,0
初高中数学教师,北京雄恩学科培训学校有限公司,2021-10-29,0
弹道设计工程师/姿控设计工程师/气动设计工程师/导航设计工程师/仿真设计工程师/结构设计工程师/机电设计工程师/强度分析工程师/web前端工程师/JAVA开发工程师/应用软件开发工程师/FPGA工程师/嵌入式软件开发工程师/硬件设计工程师/射频、天线工程师/电气系统工程师/惯性导航工程师/固体火箭发动机设计工程师/固体火箭发动机工艺工程师/质量专员/产品保障专员/市场专员/新媒体运营专员/人事行政专员/法务专员/财务专员等,北京零壹空间科技有限公司,2021-10-29,0
质量工程师,成都极米科技股份有限公司,2021-10-29,0
管理培训生,宁波机场集团有限公司,2021-10-29,0
CoE 开发工程师,思爱普（中国）有限公司,2021-10-29,0
制程工程师/软件开发工程师/光罩数据处理工程师,泉意光罩光电科技（济南）有限公司,2021-10-29,0
模拟IC设计工程师,江苏帝奥微电子股份有限公司,2021-10-29,0
航运经营管培生/航运技术管培生/财务方向管培生/数字化方向管培生/资本运营方向管培生/综合法律方向管培生/人力资源方向管培生/党建管理方向管培生/文秘方向管培生,中远海运特种运输股份有限公司,2021-10-29,0
助理工程师/装配工艺工程师/采购工程师/质量工程师,克劳斯玛菲机械（中国）有限公司,2021-10-29,0
网络优化与维护,中国联合网络通信有限公司湖南分公司,2021-10-29,0
高级售前工程师/软件工程师/经理助理,杭州兆华电子有限公司,2021-10-28,0
水务环保类/金融财务类/职能管理类,中建三局绿色产业投资有限公司,2021-10-28,0
管理培训生岗/科技岗,江西银行股份有限公司,2021-10-28,0
产品工程师/工艺制程工程师/研发工程师/设计工程师等,苏州晶方半导体科技股份有限公司,2021-10-28,0
电池 电机电控 自动驾驶（软件）/ 自动驾驶（硬件）/ 大数据（运营、产品、运行） /数字营销/创新营销/品牌营销/大客户营销等 工艺数字化、轻量化等 智能制造（生产、品质等）、机器人、生产管理等,广汽埃安新能源汽车有限公司,2021-10-28,0
消防设备研发岗,应急管理部上海消防研究所,2021-10-28,0
人工智能实习生,深圳市悦保科技有限公司,2021-10-28,0
数据开发工程师实习生/系统开发工程师实习生,青岛安值投资管理有限公司,2021-10-28,0
金融理财顾问 /信息技术专员/机构业务经理/投行业务承揽岗/ 投资研究专员,国泰君安证券股份有限公司四川分公司,2021-10-28,0
嵌入式开发,深圳市悦保科技有限公司,2021-10-28,0
大客户经理,科大讯飞股份有限公司,2021-10-28,0
专业储备岗/柜面操作岗/信息技术方向岗位,深圳农村商业银行,2021-10-28,0
软件开发类/技术服务类/应用安全类/运维开发类/系统运维类/网络运维类/终端安全等等,中汇信息技术（上海）有限公司,2021-10-28,0
算法类/软件工程类/硬件工程类/产品设计类/营销/技术支持类等等,北京极智嘉科技股份有限公司,2021-10-28,0
财务管理/法务管理/人力资源管理/运营管理/市场拓展/社区经营等,西藏新城悦物业服务股份有限公司,2021-10-28,0
物联网终端测评师,成都恒信正合科技有限公司,2021-10-28,0
机械设计师/硬件开发师/算法工程师/大数据工程师/软件工程师/数据通信工程师/暖通工程师/隧道与地下工程设计岗/隧道与地下工程检测岗/隧道与地下工程综合岗,招商局重庆交通科研设计院有限公司,2021-10-28,0
大数据开发工程师/商业智能工程师/算法工程师/DevOps工程师/前端开发工程师/后端开发工程师等,空中云汇（上海）网络科技有限公司,2021-10-28,0
软件中心研发岗300+,北京应用物理与计算数学研究所,2021-10-28,0
数学/通信工程专业教师,四川九洲技师学院,2021-10-28,0
法官助理/书记员,广东省深圳市中级人民法院,2021-10-28,0
金融科技类/操作类/业务与综合管理类,广东省农村信用社联合社,2021-10-27,0
产品策划岗/投资管理岗/招商管理岗/营运管理岗/数据分析岗/活动策划岗/媒体宣传岗/会员管理岗/人力资源岗/招标采购岗/写字楼研策岗/写字楼租赁岗/写字楼运营岗,润欣商业投资（深圳）有限公司,2021-10-27,0
总行管理培训生/万州分行管理培训生/支行管理培训生/总行信息科技部/总行数字金融部/网点工作人员,重庆三峡银行股份有限公司,2021-10-27,0
机械管理岗 /生产及工艺管理（化工）岗 /生产及工艺管理（轻工）岗/ 财务管理岗 /系统需求管理岗/营销管理岗/供应链管理岗,华劲集团股份有限公司,2021-10-27,0
产品技术员/机电技术员,广州高才信息科技有限公司,2021-10-27,0
IT培训生,汇丰软件开发（广东)有限公司,2021-10-27,0
c++/Java,北京未尔锐创科技有限公司,2021-10-27,0
IT及新技术类/网络类/业务及运营类/市场类/职能支撑,中国联合网络通信有限公司四川省分公司,2021-10-27,0
驱动软件开发工程师/嵌入式软件工程师,陕西烽火实业有限公司,2021-10-27,0
总部管培生,广东省广新控股集团有限公司,2021-10-27,0
模拟/混合信号IC工程师/数字IC设计验证工程师/助理测试工程师/算法工程师/C++软件工程师/嵌入式软件工程师/FPGA工程师/DSP工程师,成都时识科技有限公司,2021-10-27,0
营销管理培训生/产品管理培训生/综合管理培训生/前端开发工程师/java开发工程师/测试工程师/系统维护管理岗/网络安全维护岗,通联支付网络服务股份有限公司,2021-10-27,0
研发C/C++ /研发Java /安全/测试/技术支持/产品/运营/设计/职能,统信软件技术有限公司,2021-10-27,0
软件工程师,云南省医药有限公司,2021-10-27,0
博士生/研究生,中共东莞市委组织部,2021-10-27,0
西南空管局2022年新员工招聘人力岗/财务岗/计算机通信技术岗,民航西南地区空管局,2021-10-27,0
机械设备工程师 /制程整合工程师 /测试工程师 /工业工程师/ 品质工程师 /安全工程师 /电力工程师/ 气体化学工程师 暖通/空调工程师 /水务工程师 /业务工程师/ 研发工程师,超视界显示技术有限公司,2021-10-27,0
博士后研究员/ 研发 工程师/ 研发工程师助理/ 储备管理干部 /生产运营管培生 /国内销售业务员/ 海外销售业务员,佛山市国星光电股份有限公司,2021-10-27,0
研发工程师,深圳兰度生物材料有限公司,2021-10-27,0
审计/施工员/安全员等等,贵阳市人才服务中心（贵阳市人力资源市场）,2021-10-27,0
经济管理,常熟市人力资源和社会保障局,2021-10-27,0
Java开发工程师/C/C++工程师/前端开发工程师/算法工程师/大数据开发工程师/数据工程师/测试开发/测试工程师等,恒生电子股份有限公司,2021-10-27,0
软件研发/芯片研发/算法工程师/自动化工程师/综合管理/财务,中国(上海)自由贸易试验区临港新片区管理委员会,2021-10-27,0
后端开发工程师/前端开发工程师/测试工程师,福建远控科技有限公司,2021-10-27,0
电气类/计算机类/通信类/机械测控类/环境化学类/工程管理类/土建类/物流管理类/工商管理类/经济类/财会审计类/法学类（含思想政治教育、马克思主义理论等）/新闻类/汉语言文学类/档案学/气象学,广西电网有限责任公司,2021-10-26,0
硬件设计工程师/嵌入式软件工程师/Java开发工程师/web前端开发工程师/音频算法工程师/营销类岗位,广州市奥威亚电子科技有限公司,2021-10-26,0
电气/计算机/机械测控等,海南电网有限责任公司,2021-10-26,0
堆叠工程师/结构工程师/测试工程师/软件驱动工程师/安卓开发工程师/基带工程师/研发质量工程师/助理研发工程师,四川祥承智能科技有限公司,2021-10-26,0
产品测试岗/架构设计岗/人才培养及发展岗/大数据分析岗/程序开发岗,启明信息技术股份有限公司,2021-10-26,0
交通运输类/机电设备类/电气工程类/信息科学与技术类/土木工程与建筑类/综合类,重庆市铁路（集团）有限公司,2021-10-26,0
投资类管培生/工程管理类管培生/研发类管培生/财务类管培生/人力资源类管培生,力合科创集团有限公司,2021-10-26,0
FPGA工程师/采购工程师/电气工程师/光学工程师/机械工程师/人力资源专员/软件工程师/系统集成工程师/售后工程师等等,苏州源卓光电科技有限公司,2021-10-26,0
培训专员/运营专员（教务方向）/用户运营专员/营销策划专员/设计师（平面设计）/启明星管培生,上海夏山教育科技有限公司,2021-10-26,0
技术研发类 /市场营销类/项目管理类/综合支撑类,重庆市通信产业服务有限公司,2021-10-26,0
技术类岗位\业务类岗位\职能类岗位\实习生岗位,网联清算有限公司,2021-10-26,0
风资源工程师/载荷控制工程师/仿真工程师/机械设计工程师/算法助理工程师等,新疆金风科技股份有限公司,2021-10-26,0
管理培训生/销售红星,云南太古可口可乐饮料有限公司,2021-10-26,0
半导体电路设计工程师/半导体工艺开发工程师/半导体设备工程师/韩语翻译,成都高真科技有限公司,2021-10-26,0
焦平面技术研究/激光技术研究/光电系统技术研究/光电产品生产,华北光电技术研究所（中国电子科技集团公司第十一研究所）,2021-10-26,0
Java工程师/机器学习工程师/大数据工程师,上海数禾信息科技有限公司,2021-10-26,0
企业管理/土地管理/工程技术管理/工程造价管理/工程安全管理/财务审计/党务文秘/人力资源管理/,广州市高速公路有限公司,2021-10-26,0
工程设计岗 /项目管理/全过程项目咨询岗 /策划咨询/职能管理岗,中国联合工程有限公司,2021-10-26,0
产品测试岗 /架构设计岗 /人才培养及发展岗，/大数据分析岗 /程序开发岗,启明信息技术股份有限公司,2021-10-26,0
销售工程师/产品经理（PM）/现场应用工程师（FAE）/电子工程师（硬件）/系统架构师/软件工程师/数据分析员/财务专员/法务专员/运营专员,深圳中电港技术股份有限公司,2021-10-26,0
电气工程及其自动化/ 测控技术与仪器 /控制系统工程 / 计算机科学与技术 /自动化等,国核自仪系统工程有限公司,2021-10-26,0
建筑设计岗 /工程师岗 /招商运营岗 /设计管理岗-室内 /技术岗 /人力行政岗等,合商科技有限公司,2021-10-26,0
研发岗/产品岗/运营岗/销售岗,深圳市腾讯产业创投有限公司,2021-10-26,0
算法设计工程师 /光电系统链路仿真/算法设计工程师 CAD图形引擎/Rust开发工程师/C#开发工程师/Python开发工程师/PDA应用工程师 硅光版图设计/PDA应用工程师光电链路仿真与协同仿真,深圳逍遥科技有限公司,2021-10-26,0
亿联银行2022年校园招聘,吉林亿联银行股份有限公司,2021-10-26,0
研发序列/营销序列/技术序列,烟台东方威思顿电气有限公司,2021-10-26,0
临床类/研发类/法规事务类/工艺类/质量管理/商务类等,归创通桥医疗科技股份有限公司,2021-10-26,0
融媒编辑记者/视觉包装/融媒技术工程师/网络运维工程师/电子技术工程师,南京广播电视集团有限责任公司,2021-10-26,0
区域服务工程师,贝克曼库尔特商贸（中国）有限公司,2021-10-26,0
量化研究员/C++开发工程师/python开发工程师/高性能计算机工程师/前端开发/量化数据工程师/量化交易员/市场经理/市场运营经理,因诺（上海）资产管理有限公司,2021-10-26,0
标定工程师/过程设计工程师/混合动力开发工程师/信息化工程师/设备工程师,云南云内动力集团有限公司,2021-10-26,0
